Name,Price,Seller Name,Link,Image URL
Hot Sales Wholesale Tactical Riot Gear Uniform High Quality Riot Suit,$156.00 - $180.00,"Shishi city roewe security gear Co., LTD",https://www.alibaba.com/product-detail/Hot-Sales-Wholesale-Tactical-Riot-Gear_1600881502109.html,
KANGO Flame Retardant Suit for Full Body Riot Suit safety protection gear riot suit,$122.00 - $125.00,"Nanjing Kango Outdoor Products Co., Ltd.",https://www.alibaba.com/product-detail/KANGO-Flame-Retardant-Suit-for-Full_11000018019943.html,
ATI-FIRE Wholesale CE EN Complete Firefighter Gear Set with Fire Retardant Suits Gloves Boots Belt Helmet for Firefighting,$185.00 - $230.00,"Jiangshan Ati-Fire Technology Co., Ltd.",https://www.alibaba.com/product-detail/ATI-FIRE-Wholesale-CE-EN-Complete_1601211661804.html,
KANGO Hot selling Custom Mens Durable Tactical Suit Sets Professional Riot Gear Anti Hit Suit Safety Equipment,$122.00 - $125.00,"Nanjing Kango Outdoor Products Co., Ltd.",https://www.alibaba.com/product-detail/KANGO-Hot-selling-Custom-Mens-Durable_11000018034917.html,
China Cema G2 Tearproof Tactical Frog Suit Combat Shirt Pants Camouflage Tactical Uniform with Knee Brace Equipment Camouflaged,$15.59 - $18.59,"Shenzhen City Yingterui Smart Technology Co., Ltd.",https://www.alibaba.com/product-detail/China-Cema-G2-Tearproof-Tactical-Frog_1601198544881.html,
Tactical Combat PC Control Polycarbonate Riot Shield Essential Round Self Defense Shield,$13.49 - $15.49,"Wuhan Corhunter Garment Co., Ltd.",https://www.alibaba.com/product-detail/Tactical-Combat-PC-Control-Polycarbonate-Riot_10000017874519.html,
OD Green Full face riot helmet with neck protection super hard Riot helmet for sale,$18.00 - $22.00,"Zhejiang Yingfu Protection Technology Co., Ltd.",https://www.alibaba.com/product-detail/OD-Green-Full-face-riot-helmet_1600289252180.html,
New Design Tactical Black Uniform Set Light Weight Full Body Riot Tactical Safety Equipment,$45.00 - $56.00,"Nanjing Kango Outdoor Products Co., Ltd.",https://www.alibaba.com/product-detail/New-Design-Tactical-Black-Uniform-Set_1601229312222.html,
Long Sleeve Self Defense Light Weight Full Body Protection Riot Suit Hard Shell System Riot Gear,$45.00 - $56.00,"Nanjing Kango Outdoor Products Co., Ltd.",https://www.alibaba.com/product-detail/Long-Sleeve-Self-Defense-Light-Weight_1601229106543.html,
Fireproof tactical training riot control suit riot control gear,$58.00 - $60.00,"YF Protector Co., Ltd.",https://www.alibaba.com/product-detail/Fireproof-tactical-training-riot-control-suit_1600704262883.html,
Shero Hunting Tactical Gear Waterproof Vest With Radio And Cartridge Pouch 6094 Plate Carrier,$10.50 - $12.00,"Shero Xiamen Outdoor Equipment Co., Ltd.",https://www.alibaba.com/product-detail/Shero-Hunting-Tactical-Gear-Waterproof-Vest_1600775025338.html,
"JK-H-O22 Survival Kit Emergency Kit, 15 in 1 Survival Gear and Equipment Tactical Gear Camping Accessories for Outdoor Emergency",$6.00 - $7.90,Yiwu Junka E-Commerce Firm,https://www.alibaba.com/product-detail/JK-H-O22-Survival-Kit-Emergency_1600862276385.html,
Tactical Duty Belt 7 Sets Personal Defense Equipment Black Law Enforcement Utility Belt with Pouches Bag Accessories Holsters,$8.82,"Chongqing Jinlong Outdoor Products Co., Ltd.",https://www.alibaba.com/product-detail/Tactical-Duty-Belt-7-Sets-Personal_1601118869219.html,
72 Hour Training Outdoor Camo Tactic Raid Pack Versatile Combat Gear Modular Mission Rush Jungle Emergency Tactical Backpack,$7.39 - $10.49,"Baoding Yashangjie Leather Manufacturing Co., Ltd.",https://www.alibaba.com/product-detail/72-Hour-Training-Outdoor-Camo-Tactic_1600978555771.html,
Wholesale Oxford Fabric Waterproof Safety Black Tactical Gym Hunting Vest,$32.20 - $35.90,"Guangzhou Lupu Travel Products Co., Ltd.",https://www.alibaba.com/product-detail/Wholesale-Oxford-Fabric-Waterproof-Safety-Black_1600874178971.html,
GAF 1000D nylon chaleco tactico green full protective body vest quick release plate carrier,$39.51,Guangzhou Yongyi Outdoor Products Limited,https://www.alibaba.com/product-detail/GAF-1000D-nylon-chaleco-tactico-green_1600998776230.html,
Quick Release Combat Plate Carrier Nylon Molle Chaleco Tactico Heavy Duty Modular Tactical Vest,$35.00 - $50.00,"Guangzhou Dinghong Tourism Supplies Co., Ltd.",https://www.alibaba.com/product-detail/Quick-Release-Combat-Plate-Carrier-Nylon_1600814290444.html,
Shero Chaleco Tactico Security Tactical Vest Functional Molle Jpc Cp Plate Carrier Tactical Vest Gear,$6.69,"Shero Xiamen Outdoor Equipment Co., Ltd.",https://www.alibaba.com/product-detail/Shero-Chaleco-Tactico-Security-Tactical-Vest_1600736403199.html,
Custom Oxford Camo Tactical Gear is supplied with waterproof 1000dMolle quick-release tactical vest with magazine pouch,$24.90 - $29.90,"Guangzhou Fan Gongzi Commodity Manufacturing Co., Ltd.",https://www.alibaba.com/product-detail/Custom-Oxford-Camo-Tactical-Gear-is_1601015900870.html,
Gujia 1000D Oxford Green Camouflage Quick Release Tactical Gear Weighted Body Security Laser Cut Plate Carrier Tactical Vest,$31.02,"Suzhou Gujia Protection Technology Co., Ltd.",https://www.alibaba.com/product-detail/Gujia-1000D-Oxford-Green-Camouflage-Quick_1600990544141.html,
Desert Outdoor Low Shoes Winter Warm Tactical Gear Combat Boots Tactical Boots For Men,$31.00 - $35.00,"Ningxia Honglisheng Science And Trade Co., Ltd.",https://www.alibaba.com/product-detail/Desert-Outdoor-Low-Shoes-Winter-Warm_1601235691405.html,
REVIXUN Chaleco Tactico Full Protective Vest PE Combat Tactical Armor Vest Quick Release Laser Cut Plate Carrier Tactical Vest,$200.00 - $230.00,"Jiangxi Ruiweixun Protection Technology Co., Ltd.",https://www.alibaba.com/product-detail/REVIXUN-Chaleco-Tactico-Full-Protective-Vest_1600969457681.html,
Custom Training Tactical Equipment Outdoor Set Chest Rig Bag,$18.12 - $22.33,"Guangzhou Tanqiuzhe Outdoor Products Co., Ltd.",https://www.alibaba.com/product-detail/Custom-Training-Tactical-Equipment-Outdoor-Set_1600738811331.html,
Detachable chest rig Tactical Vest Combat Vest With Multi Pockets Molle Combat training&jogging wear Vest Tactical gear,$28.00 - $35.00,"Wuhan Jinteng Manufacturing & Trading Co., Ltd.",https://www.alibaba.com/product-detail/Detachable-chest-rig-Tactical-Vest-Combat_1600344494910.html,
Lightweight 1000D Oxford Tactical Assault Molle Pack Multifunctional Camouflage Hiking Vest Removable Pouches Accessory Backpack,$7.50 - $8.10,"Yiwu Weiao Bags Co., Ltd.",https://www.alibaba.com/product-detail/Lightweight-1000D-Oxford-Tactical-Assault-Molle_1601251997318.html,
Multifunctional Tactical Vest Quick Release Customer Outdoor Combat Security Chest Rig Tactical Vest,$23.26 - $27.56,"Guangzhou Fan Gongzi Commodity Manufacturing Co., Ltd.",https://www.alibaba.com/product-detail/Multifunctional-Tactical-Vest-Quick-Release-Customer_1600673662189.html,
Hot Sales Wholesale Tactical Riot Gear Uniform High Quality Riot Suit,$156.00 - $180.00,"Shishi city roewe security gear Co., LTD",https://www.alibaba.com/product-detail/Hot-Sales-Wholesale-Tactical-Riot-Gear_1600881502109.html,
Emersongear Outdoor Sports Guantes Tactico Touch Screen Hunting Gloves Cycling Tactical Gear Shooting Tactical Combat Gloves,$8.32,"Guangzhou YZH Skirmish Co., Ltd.",https://www.alibaba.com/product-detail/Emersongear-Outdoor-Sports-Guantes-Tactico-Touch_1600782556388.html,
KANGO Hot selling Custom Mens Durable Tactical Suit Sets Professional Riot Gear Anti Hit Suit Safety Equipment,$122.00 - $125.00,"Nanjing Kango Outdoor Products Co., Ltd.",https://www.alibaba.com/product-detail/KANGO-Hot-selling-Custom-Mens-Durable_11000018034917.html,
Waterproof outdoor gear camping hiking tactical backpack with 2 detachable packs,$10.00,"Shenzhen Charming Luggage Co., Ltd.",https://www.alibaba.com/product-detail/Waterproof-outdoor-gear-camping-hiking-tactical_62301281050.html,
M and P Special Use 1000D Polyester Full Body Protection Camouflage Tactical Vest Plate Carrier,$100.00 - $130.00,"China Xinxing Guangzhou Import And Export Co., Ltd.",https://www.alibaba.com/product-detail/M-and-P-Special-Use-1000D_1601206769488.html,
